Breed_ID,Breed_name,AltBreedName,PetGroup1,PetGroup2,Pet_Category_ID,MaleWtLb,Fur_Length,Avg_life_time,Temperment
0001,Teemo,,,,1,11,Long,100,"Easy to give up, usually smart sometimes stupid, Lol CREATE THIS ROW FOR OUR OWN DOG Lol"
0002,Affenpinscher,,Toy,Companion,01,9,,11.42,"Active, Adventurous, Curious, Fun-loving, Playful, Stubborn"
0003,Afghan Hound,,Sporting,Sight,01,62,,11.92,"Aloof, Clownish, Dignified, Happy, Independent"
0004,African Hunting Dog,,,,01,51,,10.75,Wild
0005,Airedale Terrier,Airedale,Terrier,Terrier,01,57,,,"Alert, Confident, Courageous, Friendly, Intelligent, Outgoing"
0006,Akbash,,Working,Guardian,01,117,,,"Affectionate, Alert, Courageous, Independent, Intelligent, Loyal"
0007,Akita,,Working,Herding,01,97,,9.92,"Alert, Courageous, Dignified, Docile, Friendly, Intelligent, Responsive"
0008,Alaskan Malamute,Malamute,Working,0rthern,01,88,,10.71,"Affectionate, Devoted, Dignified, Friendly, Loyal, Playful"
0009,American Bulldog,,Working,Guardian,01,84,,,"Affectionate, Alert, Courageous, Energetic, Gentle, Loving, Out-going, Social"
0011,American Eskimo Dog,,0n Sporting,0rthern,01,18,,,"Alert, Energetic, Friendly, Independent, Intelligent, Protective"
0010,American Staffordshire Terrier,,Terrier,Terrier,01,62,,,"Attentive, Courageous, Devoted, Friendly, Loyal, Tenacious, Intelligent"
0012,American Hairless Terrier,,Terrier,Terrier,01,11,,,"Alert, Lively, Loving, Intelligent, Inquisitive, Playful"
0013,American Water Spaniel,,Sporting,Gun,01,35,,,"Energetic, Friendly, Intelligent, Obedient, Protective, Trainable"
0014,Anatolian Shepherd,,Working,Guardian,01,115,,,"Bold, Confident, Independent, Intelligent, Proud, Steady"
0015,Appenzell Mountain Dog,Appenzeller,Working,Guardian,01,60,,,"Energetic, Fearless, Lively, Reliable, Self-assured, Social"
0016,Australian Cattle Dog/Blue Heeler,,Herding,Herding,01,46,,11.67,"Aggressive, Alert, Energetic, Intelligent, Loyal, Protective, Responsive"
0017,Australian Kelpie,Kelpie,Working,Herding,01,35,,,"Alert, Eager, Energetic, Friendly, Intelligent, Loyal, Robust"
0018,Australian Shepherd,,Terrier,Terrier,01,60,,9,"Active, Affectionate, Friendly, Good-natured, Intelligent, Protective, Loving"
0019,Australian Terrier,,Terrier,Terrier,01,11,,12.08,"Alert, Compassionate, Courageous, Even Tempered, Loyal, Spirited, Intelligent"
0020,Basenji,,Hound,Sight,01,24,,13.54,"Affectionate, Alert, Curious, Energetic, Playful, Intelligent"
0021,Basset Hound,Basset,Hound,Scenthound,01,57,,11.29,"Affectionate, Devoted, Friendly, Gentle, Sweet-tempered, Tenacious"
0022,Beagle,,Hound,Scenthound,01,24,,12.67,"Friendly, Gentle, Independent, Intelligent, Lively, Loving, Sweet"
0023,Bearded Collie,,Herding,Herding,01,51,,13.38,"Active, Alert, Hardy, Intelligent, Lively, Self-confident"
0024,Beauceron,,Herding,Herding,01,110,,,"Courageous, Obedient, Loyal, Protective, Loving"
0025,Bedlington Terrier,,Terrier,Terrier,01,20,,13.38,"Affectionate, Devoted, Energetic, Loyal, Playful, Reliable, Intelligent"
0026,Belgian Shepherd Dog Sheepdog,Groenendael,Herding,Herding,01,71,,12.5,"Active, Alert, Confident, Friendly, Hard-working, Protective, Stubborn, Watchful, Intelligent"
0027,Belgian Shepherd Laeke0is,,Herding,Herding,01,62,,,"Active, Alert, Energetic, Lively, Protective, Watchful"
0028,Belgian Shepherd Mali0is,Mali0is,Herding,Herding,01,60,,,"Active, Alert, Confident, Friendly, Hard-working, Protective, Stubborn, Watchful"
0029,Belgian Shepherd Tervuren,,Herding,Herding,01,75,,,"Alert, Attentive, Energetic, Intelligent, Loyal, Protective"
0030,Bernese Mountain Dog,,Working,Guardian,01,97,,8,"Affectionate, Faithful, Intelligent, Loyal"
0031,Bichon Frise,,0n Sporting,Companion,01,9,,12.92,"Affectionate, Cheerful, Feisty, Gentle, Playful, Intelligent, Sensitive"
0032,Black and Tan Coonhound,,Hound,Scenthound,01,121,,,"Adaptable, Easygoing, Even-tempered, Gentle, Lovable, Trusting, Intelligent"
0033,Black Labrador Retriever,,Sporting,Gun,01,71,,,"Affectionate, Alert, Cheerful, Energetic, Friendly, Gentle, Intelligent, Loving, Loyal, Outgoing, Playful, Responsive, Social"
0034,Black Mouth Cur,,Hound,Scenthound,01,71,,,"Active, Fearless, Kind, Loyal, Protective, Trainable"
0035,Black Russian Terrier,,Working,Guardian,01,112,,,"Brave, Confident, Energetic, Hardy, Lively, Stable"
0036,Bloodhound,,Hound,Scenthound,01,101,,6.79,"Affectionate, Even-tempered, Gentle, Stubborn, Independent"
0037,Blue Lacy,,Sporting,Gun,01,40,,,"Active, Alert, Bold, Devoted, Intelligent, Intense"
0038,Bluetick Coonhound,Bluetick,Hound,Scenthound,01,62,,,"Friendly, Active, Gentle"
0039,Boerboel,,Working,Guardian,01,176,,,"Confident, Dominant, Intelligent, Obedient, Territorial"
0040,Bolognese,,Working,Companion,01,7,,,"Docile, Enterprising, Loyal, Reserved, Serious"
0041,Border Collie,,Herding,Herding,01,37,,12.25,"Intelligent, Energetic, Alert, Responsive, Tenacious, Loyal, Protective"
0042,Border Terrier,,Terrier,Terrier,01,15,,14,"Affectionate, Alert, Even-tempered, Fearless, Intelligent, Obedient"
0043,Borzoi,,Hound,Sight,01,90,,9.08,"Athletic, Gentle, Independent, Intelligent, Quiet, Respectful"
0044,Boston Terrier,Boston Bull,0n Sporting,Companion,01,20,,10.92,"Affectionate, Aggressive, Friendly, Gentle, Intelligent, Lively, Playful"
0045,Bouvier des Flanders,,Herding,Herding,01,93,,11.33,"Familial, Gentle, Intelligent, Loyal, Protective, Rational"
0046,Boxer,,Working,Guardian,01,66,,10.25,"Brave, Bright, Confident, Energetic, Fearless, Friendly, Intelligent, Loyal, Playful"
0047,Boykin Spaniel,,Sporting,Gun,01,33,,,"Companionable, Eager, Energetic, Friendly, Intelligent, Trainable"
0048,Briard,,Herding,Gun,01,77,,11.17,"Faithful, Fearless, Intelligent, Loyal, Obedient, Protective"
0049,Brittany Spaniel,,Sporting,Gun,01,37,,12.88,"Alert, Independent, Intelligent, Responsive, Social"
0050,Brussels Griffon,Brabancon Griffon,Toy,Companion,01,9,,,"Alert, Companionable, Inquisitive, Self-important, Sensitive, Watchful"
0051,Bull Terrier,American Pit Bull Terrier,Terrier,Terrier,01,62,,10,"Active, Keen, Protective, Sweet-tempered, Trainable"
0052,Bullmastiff,Bull Mastiff,Working,Guardian,01,121,,7.46,"Alert, Calm, Courageous, Devoted, Docile, Powerful, Loyal, Protective, Reliable"
0053,Cairn Terrier,Cairn,Terrier,Terrier,01,15,,14,"Active, Assertive, Courageous, Fearless, Hardy, Intelligent"
0054,Canaan Dog,,Herding,Sight,01,46,,14.63,"Alert, Cautious, Devoted, Quick, Vigilant"
0055,Cane Corso Mastiff,,Working,Guardian,01,104,,,"Cheerful, Courageous, Loyal, Quiet, Social"
0056,Carolina Dog,,,Sight,01,40,,,"Adaptable, Gentle, Loyal, Primitive, Reserved"
0057,Catahoula Leopard Dog,,Herding,Herding,01,60,,,"Alert, Courageous, Energetic, Gentle, Independent, Intelligent, Loving, Loyal, Protective"
0058,Cattle Dog,,Herding,Herding,01,46,,,"Aggressive, Alert, Energetic, Intelligent, Loyal, Protective, Responsive"
0059,Caucasian Sheepdog (Caucasian Ovtcharka),,Working,Guardian,01,139,,,"Alert, Calm, Dominant, Powerful, Quick,Strong"
0060,Cavalier King Charles Spaniel,,Toy,Companion,01,15,,11.38,"Affectionate, Cheerful, Courageous, Gentle, Intelligent, Social"
0061,Chesapeake Bay Retriever,,Sporting,Gun,01,73,,10.75,"Happy, Affectionate, Dominant, Intelligent, Protective, Quiet"
0062,Chihuahua,,Toy,Companion,01,4,,12.42,"Alert, Courageous, Devoted, Lively, Intelligent, Quick"
0063,Chinese Crested Dog,,Toy,Companion,01,9,,10.08,"Affectionate, Alert, Happy, Lively, Playful, Sweet-tempered"
0064,Chinese Foo Dog,,Working,0rthern,01,55,,,"Friendly, Devoted, Courageous"
0065,Chi0ok,,Working,0rthern,01,71,,,"Alert, Calm, Dignified, Friendly, Responsive"
0066,Chocolate Labrador Retriever,,Sporting,Gun,01,71,,,"Affectionate, Alert, Cheerful, Energetic, Friendly, Gentle, Intelligent, Loving, Loyal, Outgoing, Playful, Responsive, Social"
0067,Chow Chow,Chow,0n Sporting,0rthern,01,57,,9.38,"Aloof, Independent, Loyal, Quiet, Intelligent, Protective, Detached"
0068,Cirneco dell'Etna,,Hound,Sight,01,24,,10.33,"Affectionate, Gentle, Lively"
0069,Clumber Spaniel,Clumber,Sporting,Gun,01,71,,,"Gentle, Loyal, Affectionate, Dignified, Aloof"
0070,Cockapoo,,Sporting,Gun,01,18,,,"Affectionate, Alert, Cheerful, Friendly, Intelligent, Loving, Loyal, Outgoing, Playful, Responsive, Social"
0071,Cocker Spaniel,,Sporting,Gun,01,22,,11.17,"Even Tempered, Joyful, Merry, Outgoing, Intelligent, Sociable, Trusting"
0072,Collie,,Herding,Herding,01,68,,12.67,"Friendly, Gentle, Intelligent, Loyal, Protective, Responsive, Social"
0073,Coonhound,,Hound,Scenthound,01,121,,,"Adaptable, Easygoing, Even-tempered, Gentle, Lovable, Trusting, Intelligent"
0074,Corgi,,Herding,Herding,01,29,,,"Active, Affectionate, Alert, Companionable, Devoted, Gentle, Intelligent"
0075,Coton de Tulear,,0n Sporting,Companion,01,13,,,"Affectionate, Intelligent, Lively, Playful, Trainable, Vocal"
0076,Curly-Coated Retriever,,Sporting,Gun,01,75,,10.75,"Clever, Independent, Intelligent, Lively, Sensitive, Trainable"
0077,Dachshund,,Hound,Scenthound,01,15,,12.67,"Clever, Courageous, Devoted, Lively, Playful, Stubborn"
0078,Dalmatian,,0n Sporting,Companion,01,55,,12.5,"Active, Energetic, Friendly, Intelligent, Outgoing, Playful, Sensitive"
0079,Dandi Dinmont Terrier,Dandie Dinmont,Terrier,Terrier,01,22,,12.17,"Affectionate, Companionable, Determined, Fun-loving, Independent, Lively, Intelligent"
0080,Dhole,,,,01,40,,,Wild
0081,Dingo,,,,01,35,,,Wild
0082,Doberman Pinscher,Doberman,Working,Guardian,01,95,,10.5,"Alert, Energetic, Fearless, Intelligent, Loyal, Obedient"
0083,Dogo Argenti0,,Working,Guardian,01,95,,,"Affectionate, Cheerful, Friendly, Loyal, Protective, Tolerant, Social"
0084,Dogue de Bordeaux,,Working,Guardian,01,132,,3.83,"Companionable, Courageous, Devoted, Even-tempered, Loyal, Vigiliant"
0085,Dutch Shepherd,,Herding,Herding,01,62,,,"Affectionate, Alert, Loyal, Obedient, Reliable, Trainable"
0086,English Bulldog,,0n Sporting,Companion,01,55,,,"Aggressive, Courageous, Friendly, Loving, Social, Sweet"
0087,English Cocker Spaniel,,Sporting,Gun,01,31,,,"Affectionate, Faithful, Friendly, Intelligent, Playful, Quiet, Trainable"
0088,English Coonhound,,Hound,Scenthound,01,57,,,"Active, Energetic, High-strung, Loyal"
0089,English Pointer,,Sporting,Gun,01,55,,,"Active, Affectionate, Amiable, Even-tempered, Kind, Loyal, Intelligent"
0090,English Setter,,Sporting,Gun,01,66,,11.58,"Strong-willed, Mischevious, Gentle, Energetic, Intelligent"
0091,English Shepherd,,Herding,Herding,01,55,,,"Adaptable, Alert, Courageous, Energetic, Friendly, Independent, Intelligent, Playful, Responsibe"
0092,English Springer Spaniel,,Sporting,Gun,01,51,,12,"Affectionate, Alert, Cheerful, Energetic, Intelligent, Playful, Social"
0093,English Toy Spaniel,Blenheim Spaniel,Toy,Companion,01,11,,,"Affectionate, Gentle, Happy, Loving, Playful, Reserved"
0094,Entlebucher,,Herding,Guardian,01,60,,,"Agile, Devoted, Independent, Loyal, Self-confident"
0095,Eskimo Dog,,0n Sporting,0rthern,01,18,,,"Alert, Energetic, Friendly, Independent, Intelligent, Protective"
0096,Feist,,Terrier,Terrier,01,33,,,"Agile, Alert, Lovable, Spirited, Swift"
0097,Field Spaniel,,Sporting,Gun,01,42,,11.63,"Adaptable, Cautious, Docile, Familial, Sensitive, Sociable"
0098,Fila Brasileiro,,Working,Guardian,01,101,,,"Brave, Courageous, Determined, Docile, Loyal, Obedient"
0099,Finnish Lapphund,,Herding,0rthern,01,40,,7.33,"Calm, Courageous, Faithful, Friendly, Keen"
0100,Finnish Spitz,,0n Sporting,0rthern,01,33,,11.13,"Happy, Independent, Intelligent, Loyal, Playful, Vocal"
0101,Flat-coated Retriever,,Sporting,Gun,01,66,,9.83,"Friendly, Confident, Devoted, Optimistic, Outgoing, Intelligent"
0102,Fox Terrier,,Terrier,Terrier,01,18,,13.13,"Active, Affectionate, Alert, Fearless, Intelligent, Playful"
0103,Foxhound,,Hound,Scenthound,01,71,,,"Independent, Intelligent, Kind, Loving, Loyal, Sweet-tempered"
0104,French Bulldog,,0n Sporting,Companion,01,26,,9,"Affectionate, Playful, Alert, Athletic, Bright, Easygoing, Keen, Lively, Patient"
0105,Galgo Spanish Greyhound,,Hound,Sight,01,55,,,"Affectionate, Calm, Quiet, Gentle"
0106,German Pinscher,,Working,Terrier,01,31,,11.38,"Even-tempered, Familial, Courageous, Lively, Loving, Spirited"
0107,German Shepherd Dog,German Shepherd,Herding,Herding,01,77,,,"Alert, Confident, Courageous, Curious, Intelligent, Loyal, Obedient, Watchful"
0108,German Shorthaired Pointer,German Short Haired Pointer,Working,Gun,01,64,,12,"Affectionate, Boisterous, Bold, Cooperative, Intelligent, Trainable"
0109,German Spitz,,0n Sporting,0rthern,01,18,,11.33,"Alert, Energetic, Friendly, Independent, Intelligent, Protective"
0110,German Wirehaired Pointer,,Sporting,Gun,01,66,,10,"Active, Affectionate, Friendly, Intelligent, Loyal, Willful, Responsive"
0111,Giant Schnauzer,,Working,Companion,01,84,,10,"Dominant, Intelligent, Kind, Loyal, Powerful, Strong-willed"
0112,Glen of Imaal Terrier,,Terrier,Terrier,01,35,,10.42,"Active, Agile, Courageous, Gentle, Loyal, Spirited"
0113,Golden Retriever,,Sporting,Gun,01,71,,12.25,"Confident, Friendly, Intelligent, Kind, Reliable, Trustworthy"
0114,Gordon Setter,,Sporting,Gun,01,68,,11.08,"Alert, Confident, Eager, Fearless, Loyal, Intelligent"
0115,Great Dane,,Working,Guardian,01,170,,6.5,"Friendly, Confident, Devoted, Intelligent, Gentle, Loving, Reserved"
0116,Great Pyrenees,,Working,Guardian,01,99,,,"Affectionate, Confident, Fearless, Gentle, Patient, Strong-willed"
0117,Greater Swiss Mountain Dog,,Working,Guardian,01,132,,,"Alert, Devoted, Fearless, Good-natured, Protective, Self-confident"
0118,Greyhound,,Hound,Sight,01,73,,9.08,"Intelligent, Gentle, Affectionate, Athletic, Even-tempered, Quiet"
0119,Harrier,,Hound,Scenthound,01,49,,,"Active, Cheerful, Friendly, Outgoing, Sweet-tempered, Tolerant"
0120,Havanese,,Toy,Companion,01,11,,10.25,"Affectionate, Companionable, Gentle, Intelligent, Playful, Responsive"
0121,Hound,,Hound,Scenthound,01,71,,,"Independent, Intelligent, Kind, Loving, Loyal, Sweet-tempered"
0122,Hovawart,,Working,Guardian,01,84,,12.92,"Watchful, Even-tempered, Reserved, Active, Devoted"
0123,Husky,,Working,0rthern,01,53,,,"Alert, Friendly, Gentle, Intelligent, Outgoing"
0124,Ibizan Hound,,Hound,Sight,01,49,,,"Active, Clownish, Engaging, Independent, Intelligent, Stubborn"
0125,Illyrian Sheepdog,,Herding,Herding,01,88,,,"Independent, Reliable, Devoted, Protective"
0126,Irish Setter,,Sporting,Gun,01,71,,12,"Affectionate, Companionable, Energetic, Independent, Lively, Playful, Intelligent"
0127,Irish Terrier,,Terrier,Terrier,01,26,,14.83,"Dominant, Intelligent, Lively, Protective, Respectful, Trainable"
0128,Irish Water Spaniel,,Sporting,Gun,01,55,,9.33,"Active, Alert, Clownish, Inquisitive, Intelligent, Quick"
0129,Irish Wolfhound,,Hound,Scenthound,01,121,,7.04,"Dignified, Generous, Loyal, Patient, Sweet-tempered, Thoughtful, Intelligent"
0130,Italian Greyhound,,Toy,Companion,01,9,,13.5,"Affectionate, Agile, Athletic, Companionable, Intelligent, Mischevious"
0131,Italian Spi0ne,,Sporting,Gun,01,73,,9,"Friendly, Loyal, Affectionate, Docile, Gentle, Patient"
0132,Jack Russell Terrier,,Terrier,Terrier,01,15,,,"Alert, Cheerful, Courageous, Energetic, Independent"
0133,Jack Russell Terrier (Parson Russell Terrier),,Terrier,Terrier,01,15,,,"Energetic, Bold, Eager, Happy, Intelligent, Obedient"
0134,Japanese Chin,Japanese Spaniel,Toy,Companion,01,11,,9.25,"Alert, Cat-like, Independent, Intelligent, Loving, Loyal, Playful"
0135,Jindo,,Sporting,0rthern,01,44,,,"Active, Bold, Brave, Faithful, Intelligent, Loyal"
0136,Kai Dog,,0n Sporting,0rthern,01,40,,,"Intelligent, Agile, Alert, Brave"
0137,Karelian Bear Dog,,Sporting,0rthern,01,49,,,"Brave, Cautious, Loyal, Independent, Tenacious, Territorial"
0138,Keeshond,,0n Sporting,0rthern,01,40,,12.21,"Agile, Bright, Obedient, Playful, Quick, Sturdy, Intelligent"
0139,Kerry Blue Terrier,,Terrier,Terrier,01,37,,11.5,"Affectionate, Alert, Gentle, Loyal, Spirited, Strong-willed, Intelligent"
0140,Kishu,,Sporting,0rthern,01,44,,,"Alert, Dignified, Docile, Faithful, 0ble"
0141,Klee Kai,,0n Sporting,0rthern,01,15,,,"Active, Agile, Curious, Intelligent, Loyal, Quick, Territorial"
0142,Komondor,,Working,Guardian,01,130,,9.13,"Affectionate, Calm, Fearless, Gentle, Independent, Steady"
0143,Kuvasz,,Working,Guardian,01,108,,,"Clownish, Independent, Intelligent, Loyal, Patient, Protective"
0144,Kyi Leo,,0n Sporting,Companion,01,11,,,"Active, Calm, Forgiving, Obedient, Playful, Quiet"
0145,Labrador Retriever,,Sporting,Gun,01,71,,12.25,"Affectionate, Alert, Cheerful, Energetic, Friendly, Gentle, Intelligent, Loving, Loyal, Outgoing, Playful, Responsive, Social"
0146,Lakeland Terrier,,Terrier,Terrier,01,18,,15.46,"Independent, Bold, Confident, Friendly, Intelligent, Trainable"
0147,Lancashire Heeler,,Herding,Herding,01,11,,11.75,"Alert, Clever, Friendly, Intelligent"
0148,Leonberger,,Working,Guardian,01,141,,7.08,"Adaptable, Companionable, Fearless, Loving, Loyal, Obedient"
0149,Lhasa Apso,,0n Sporting,Companion,01,13,,14.33,"Alert, Assertive, Devoted, Friendly, Intelligent, Lively, Obedient, Playful, Spirited, Steady"
0150,Lowchen,,0n Sporting,Companion,01,13,,10,"Active, Familial, Friendly, Happy, Playful"
0151,Maltese,Maltese Dog,Toy,Companion,01,9,,12.25,"Active, Docile, Easygoing, Gentle, Intelligent, Playful, Responsive, Sweet-tempered"
0152,Manchester Terrier,,Terrier,Terrier,01,13,,12.83,"Active, Alert, Devoted, Discerning, Quiet, Loyal, Intelligent"
0153,Maremma Sheepdog,,Working,Guardian,01,84,,10,"Alert, Determined, Dignified, Friendly, Intelligent, Loyal"
0154,Mastiff,,Working,Guardian,01,198,,6.83,"Affectionate, Alert, Cheerful, Courageous, Intelligent, Loyal, Protective"
0155,McNab,,Herding,Herding,01,51,,,"Friendly, Hard-working, Obedient, Protective, Sociable, Well-mannered"
0156,Miniature Pinscher,,Toy,Companion,01,11,,13,"Clever, Energetic, Friendly, Outgoing, Playful, Responsive, Intelligent"
0157,Mountain Cur,,Working,Scenthound,01,44,,,"Intelligent, Protective"
0158,Mountain Dog,,Working,Guardian,01,97,,,"Affectionate, Faithful, Intelligent, Loyal"
0159,Munsterlander,,Sporting,Gun,01,44,,,"Intelligent, Trainable, Attentive, Mischevious"
0160,Neapolitan Mastiff,,Working,Guardian,01,132,,2.33,"Protective, Dominant, Fearless, Obedient, Stubborn, Trainable"
0161,New Guinea Singing Dog,,Southern,Southern,01,24,,,"Active, Affectionate, Alert, Gentle, Lively"
0162,Newfoundland Dog,Newfoundland,Working,Guardian,01,143,,9.67,"Cheerful, Courageous, Intelligent, Loyal, Social, Sweet, Gentle"
0163,0rfolk Terrier,,Terrier,Terrier,01,11,,11,"Companionable, Fearless, Happy, Lovable, Self-confident, Spirited, Intelligent"
0164,0rwegian Buhund,,Herding,0rthern,01,35,,12.67,"Agile, Courageous, Energetic, Friendly, Fun-loving"
0165,0rwegian Elkhound,,Hound,0rthern,01,57,,13.17,"Alert, Bold, Hardy, Loyal, Playful, Strong-willed, Intelligent"
0166,0rwegian Lundehund,,0n Sporting,0rthern,01,18,,,"Alert, Energetic, Loyal, Protective"
0167,0rwich Terrier,,Terrier,Terrier,01,11,,13.38,"Affectionate, Energetic, Hardy, Intelligent, Sensitive"
0168,0va Scotia Duck-Tolling Retriever,,Sporting,Gun Dogs,01,44,,8,"Affectionate, Alert, Courageous, Energetic, Gentle, Playful, Responsive"
0169,Old English Sheepdog,,Herding,Herding,01,86,,10.75,"Adaptable, Bubbly, Intelligent, Loving, Playful, Sociable, Protective"
0170,Otterhound,,Hound,Scenthound,01,90,,10.21,"Amiable, Boisterous, Even-tempered"
0171,Papillon,,Toy,Companion,01,11,,13.08,"Alert, Energetic, Friendly, Happy, Hardy, Intelligent"
0172,Patterdale Terrier (Fell Terrier),,Terrier,Terrier,01,13,,,"Bold, Confident, Energetic, Friendly, Inquisitive, Intelligent"
0173,Pekingese,,Toy,Companion,01,9,,11.42,"Affectionate, Aggressive, Good-natured, Intelligent, Opinionated, Stubborn"
0174,Peruvian Inca Orchid,,Hound,Sight,01,22,,,"Affectionate, Alert, Intelligent, Lively, 0ble, Protective"
0175,Petit Basset Griffon Vendeen,,Hound,Scenthound,01,35,,,"Active, Extroverted, Friendly, Happy, Independent, Lively, Intelligent"
0176,Pharaoh Hound,,Hound,Sight,01,51,,11.83,"Active, Affectionate, Intelligent, Playful, Sociable, Trainable"
0177,Pit Bull Terrier,,Terrier,Terrier,01,51,,,"Affectionate, Aggressive, Clownish, Courageous, Friendly, Intelligent, Loyal, Obedient, Strong-willed, Stubborn"
0178,Plott Hound,,Hound,Scenthound,01,57,,,"Alert, Bold, Courageous, Loyal"
0179,Podengo Portugueso,,Hound,Sight,01,11,,,"Active, Companionable, Friendly, Hardy, Lively, Loyal"
0180,Pointer,,Sporting,Gun,01,55,,12.42,"Active, Affectionate, Amiable, Even-tempered, Kind, Loyal, Intelligent"
0181,Polish Lowland Sheepdog,,Herding,Herding,01,42,,9.58,"Agile, Even-tempered, Lively, Perceptive, Self-confident"
0182,Pomeranian,,Toy,Companion,01,4,,9.67,"Active, Extroverted, Friendly, Intelligent, Lively, Playful, Sociable"
0183,Poodle,,0n Sporting,Gun,01,57,Long,,"Active, Alert, Faithful, Instinctual, Intelligent, Trainable"
0184,Standard Poodle,,0n Sporting,Gun,01,57,,12,"Active, Alert, Faithful, Instinctual, Intelligent, Trainable"
0185,Miniature Poodle,,Toy,Companion,01,18,,,"Active, Alert, Faithful, Instinctual, Intelligent, Trainable"
0186,Toy Poodle,,Toy,Companion,01,9,Long,,"Active, Alert, Faithful, Instinctual, Intelligent, Trainable"
0187,Portuguese Water Dog,,Working,Gun,01,49,,11.42,"Brave, Docile, Impetuous, Intelligent, Obedient, Quarrelsome"
0188,Presa Canario,,Working,Guardian,01,88,,,"Calm, Dominant, Gentle, Strong-willed, Suspicious"
0189,Pug,,Toy,Companion,01,18,,11,"Affectionate, Cheerful, Courageous, Gentle, Intelligent, Friendly, Outgoing, Playful, Loyal"
0190,Puli,,Herding,Herding,01,31,,,"Agile, Energetic, Faithful, Intelligent, Loyal, Obedient"
0191,Pumi,,Herding,Herding,01,29,,,"Active, Intelligent, Lively, Protective, Reserved, Vocal"
0192,Rat Terrier,,Terrier,Terrier,01,24,,,"Affectioante, Alert, Inquisitive, Lively, Loving"
0193,Redbone Coonhound,Redbone,Hound,Scenthound,01,62,,,"Affectionate, Companionable, Energetic, Familial, Independent, Unflappable"
0194,Retriever,,Sporting,Gun,01,71,,,"Confident, Friendly, Intelligent, Kind, Reliable, Trustworthy"
0195,Rhodesian Ridgeback,,Hound,Sight,01,86,,11,"Dignified, Intelligent, Loyal, Mischevious, Sensitive, Strong-willed"
0196,Rottweiler,,Working,Guardian,01,112,,8.92,"Alert, Courageous, Fearless, Good-natured, Independent, Intelligent, Loyal, Protective"
0197,Saint Bernard,,Working,Guardian,01,146,,,"Friendly, Gentle, Independent, Intelligent, Outgoing, Quiet, Social"
0198,Saluki,,Hound,Sight,01,46,,12,"Aloof, Intelligent, Quiet, Reserverd, Loyal"
0199,Samoyed,,Working,0rthern,01,57,Long,12.5,"Alert, Lively, Friendly, Intelligent, Playful, Sociable, Stubborn"
0200,Sarplaninac,,Working,Guardian,01,73,,,"Independent, Calm, Devoted, Intelligent, Protective, Reliable"
0201,Schipperke,,0n Sporting,Companion,01,15,,13,"Agile, Confident, Curious, Faithful, Fearless, Independent, Intelligent"
0202,Miniature Schnauzer,,Terrier,Companion,01,18,,,"Devoted, Good-natured, Intelligent, Lively, Playful, Trainable"
0203,Schnauzer,Standard Schnauzer,Working,Herding,01,37,Long,11.96,"Devoted, Good-natured, Intelligent, Lively, Playful, Trainable"
0204,Giant Schnauzer,,Working,Herding,01,68,,,"Devoted, Good-natured, Intelligent, Lively, Playful, Trainable"
0205,Scottish Deerhound,,Hound,Sight,01,93,,,"Dignified, Docile, Friendly, Gentle, Polite, Quiet"
0206,Scottish Terrier Scottie,Scotch Terrier,Terrier,Terrier,01,20,,,"Independent, Fiesty, Alert, Playful, Quick, Self-assured"
0207,Sealyham Terrier,,Terrier,Terrier,01,20,,10.25,"Alert, Calm, Even-tempered, Fearless, Friendly, Intelligent"
0208,Setter,,Sporting,Gun,01,66,,,"Strong-willed, Mischevious, Gentle, Energetic, Intelligent"
0209,Shar Pei,,0n Sporting,0rthern,01,49,,6.29,"Affectionate, Devoted, Independent, Loving, Reserved, Suspicious"
0210,Sheep Dog,,Herding,Herding,01,86,,,"Adaptable, Bubbly, Intelligent, Loving, Playful, Sociable, Protective"
0211,Shepherd,,Herding,Herding,01,77,,,"Alert, Confident, Courageous, Curious, Intelligent, Loyal, Obedient, Watchful"
0212,Shetland Sheepdog Sheltie,Shetland Sheepdog,Herding,Herding,01,20,,12.5,"Affectionate, Friendly, Gentle, Intelligent, Lively, Playful, Responsive"
0213,Shiba Inu,,0n Sporting,Companion,01,22,,7,"Alert, Charming, Confident, Faithful, Fearless, Keen, Outgoing"
0214,Shih Tzu,,Toy,Companion,01,13,,13.17,"Active, Courageous, Friendly, Gentle, Happy, Intelligent, Lively, Outgoing, Playful"
0215,Siberian Husky,,Working,0rthern,01,53,,12.58,"Alert, Friendly, Gentle, Intelligent, Outgoing"
0216,Silky Terrier,,Toy,Terrier,01,11,,,"Alert, Friendly, Inquisitive, Joyful, Quick, Responsive, Intelligent"
0217,Skye Terrier,,Terrier,Terrier,01,37,,11,"Loyal, Fearless, Friendly, Good-tempered, Intelligent"
0218,Sloughi,,Hound,Sight,01,62,,,"Alert, Faithful, Intelligent, Sensitive, Independent, Playful, Sweet"
0219,Smooth Fox Terrier,,Terrier,Terrier,01,18,,,"Active, Affectionate, Alert, Fearless, Intelligent, Playful"
0220,South Russian Ovtcharka,,Herding,Herding,01,108,,,"Active, Balanced, Courageous, Lively, Nervous"
0221,Spaniel,,Sporting,Gun,01,22,,,"Even Tempered, Joyful, Merry, Outgoing, Intelligent, Sociable, Trusting"
0222,Spitz,,0n Sporting,0rthern,01,18,,,"Alert, Energetic, Friendly, Independent, Intelligent, Protective"
0223,Staffordshire Bull Terrier,Staffordshire Bullterrier,Terrier,Terrier,01,31,,12.75,"Affectionate, Bold, Courageous, Fearless, Intelligent, Reliable"
0224,Sussex Spaniel,,Sporting,Gun,01,42,,11.13,"Calm, Cheerful, Companionable, Devoted, Friendly, Sociable"
0225,Swedish Vallhund,,Herding,Herding,01,29,,,"Alert, Energetic, Fearless, Friendly, Watchful"
0226,Terrier,,Terrier,Terrier,01,18,,,"Affectionate, Alert, Courageous, Intelligent, Friendly, Hardy, Independent"
0227,Thai Ridgeback,,Hound,Sight,01,62,,,"Familial, Independent, Loving, Loyal, Protective"
0228,Tibetan Mastiff,,Working,Guardian,01,157,,,"Aloof, Protective, Strong-willed, Stubborn, Courageous, Loyal"
0229,Tibetan Spaniel,,0n Sporting,Companion,01,13,,,"Intelligent, Assertive, Aloof, Happy, Independent, Willful"
